beam_id,title,category_main_group,category_sub_group,category,categories,address,street,city,state,borough,neighborhood,postal_code,country,address_verified,latitude,longitude,timezone,phone,price_level,business_status,has_open_hours,has_price,census_place,verified_census_city,beam_location_name,beam_state_code,beam_country_code,website_protocol,website,website_normalized,website_domain,website_domain_tld,website_domain_age,website_domain_registered,website_domain_expires,website_domain_registrar,emails_list,emails_list_website_domain,emails_count,emails_deliverable_count,emails_risky_count,description,has_about,has_description,rating,reviews_total_count,reviews_per_rating,service_options,highlights,popular_for,accessibility,offerings,dining_options,amenities,atmosphere,crowd,planning,payments,children,has_popular_times,has_website,has_email,has_social,has_phone,socials_count,first_social_post_date,last_social_post_date,first_social_post_days,last_social_post_days,social_post_count,first_social_post_days_min,first_social_post_days_max,last_social_post_days_min,last_social_post_days_max,social_profile_instagram,social_username_instagram,social_profile_facebook,social_username_facebook,social_profile_twitter,social_username_twitter,social_profile_tiktok,social_username_tiktok,social_profile_linkedin,social_username_linkedin,social_profile_youtube,social_username_youtube,social_profile_github,social_username_github,social_profile_snapchat,social_username_snapchat,social_profile_pinterest,social_username_pinterest,instagram_followers,instagram_engagement_rate,instagram_engagement_rate_1m,instagram_engagement_rate_3m,instagram_engagement_rate_6m,instagram_engagement_rate_12m,instagram_post_count,tiktok_followers,tiktok_video_count,tiktok_heart_count,tiktok_engagement_rate,tiktok_engagement_rate_1m,tiktok_engagement_rate_3m,tiktok_engagement_rate_6m,tiktok_engagement_rate_12m,menu_link,order_links,reservation_link,last_updated_at,beam_cross_social_market_penetration,beam_cross_velocity_quality,beam_cross_social_urgency,beam_cross_per_capita_engagement,beam_cross_market_saturation_lead,beam_cross_population_adjusted_rank,beam_cross_demand_gap_index,beam_rating_score,beam_review_confidence,beam_rating_health,sentiment_avg,sentiment_avg_30d,sentiment_avg_90d,sentiment_avg_180d,sentiment_avg_360d,sentiment_percentile_1km,sentiment_percentile_5km,sentiment_percentile_10km,sentiment_score_90d,sentiment_score_360d,sentiment_positive_pct_30d,sentiment_negative_pct_30d,sentiment_neutral_pct_30d,sentiment_positive_pct_90d,sentiment_negative_pct_90d,sentiment_neutral_pct_90d,sentiment_positive_pct_180d,sentiment_negative_pct_180d,sentiment_neutral_pct_180d,sentiment_positive_pct_360d,sentiment_negative_pct_360d,sentiment_neutral_pct_360d,sentiment_trend_30vs90d,sentiment_trend_90vs360d,sentiment_diff_30vs90d,sentiment_change_360d,sentiment_diff_90vs360d,sentiment_change_pct_360d,reviews_count_30d,reviews_count_90d,reviews_count_180d,reviews_count_360d,review_growth_pct_180d,review_growth_pct_360d,review_growth_pct_90d,beam_score_overall,beam_popularity_percentile,beam_social_presence,beam_data_completeness,beam_price_value,beam_data_freshness,beam_rank_city_category,beam_rank_city_overall,beam_rank_city_reviews,beam_rank_state_category,beam_rank_state_overall,beam_rank_state_reviews,beam_rank_country_category,beam_rank_country_overall,beam_rank_country_reviews,beam_rank_place_global_category,beam_rank_category,beam_rank_competition_1km_category,beam_rank_competition_1km_total,beam_rank_competition_1km_reviews,beam_rank_competition_5km_category,beam_rank_competition_5km_total,beam_rank_competition_5km_reviews,beam_rank_competition_10km_category,beam_rank_competition_10km_total,beam_rank_competition_10km_reviews,beam_export_rank,total_city_category,total_city,total_state_category,total_state,total_country_category,total_country,total_category_global,beam_competitors_10km_competitive_strength,beam_competitors_10km_competitor_avg_sentiment_30d,beam_competitors_10km_competitor_avg_sentiment_90d,beam_competitors_10km_sentiment_diff_30d,beam_competitors_10km_sentiment_diff_90d,beam_competitors_1km_competitive_strength,beam_competitors_1km_competitor_avg_sentiment_30d,beam_competitors_1km_competitor_avg_sentiment_90d,beam_competitors_1km_sentiment_diff_30d,beam_competitors_1km_sentiment_diff_90d,beam_competitors_5km_competitive_strength,beam_competitors_5km_competitor_avg_sentiment_30d,beam_competitors_5km_competitor_avg_sentiment_90d,beam_competitors_5km_sentiment_diff_30d,beam_competitors_5km_sentiment_diff_90d,beam_competitors_10km_competitor_count,beam_competitors_1km_competitor_count,beam_competitors_5km_competitor_count,beam_competitors_1km_rank_by_score,beam_competitors_1km_rank_by_rating,beam_competitors_1km_rank_by_reviews,beam_competitors_1km_score_percentile,beam_competitors_1km_rating_percentile,beam_competitors_1km_reviews_percentile,beam_competitors_1km_health_percentile,beam_competitors_1km_sentiment_percentile,beam_competitors_1km_competitor_avg_score,beam_competitors_1km_competitor_avg_rating,beam_competitors_1km_competitor_avg_reviews,beam_competitors_1km_competitor_avg_health,beam_competitors_1km_competitor_avg_sentiment,beam_competitors_1km_score_diff,beam_competitors_1km_rating_diff,beam_competitors_1km_reviews_diff,beam_competitors_1km_health_diff,beam_competitors_1km_sentiment_diff,beam_competitors_5km_rank_by_score,beam_competitors_5km_rank_by_rating,beam_competitors_5km_rank_by_reviews,beam_competitors_5km_score_percentile,beam_competitors_5km_rating_percentile,beam_competitors_5km_reviews_percentile,beam_competitors_5km_health_percentile,beam_competitors_5km_sentiment_percentile,beam_competitors_5km_competitor_avg_score,beam_competitors_5km_competitor_avg_rating,beam_competitors_5km_competitor_avg_reviews,beam_competitors_5km_competitor_avg_health,beam_competitors_5km_competitor_avg_sentiment,beam_competitors_5km_score_diff,beam_competitors_5km_rating_diff,beam_competitors_5km_reviews_diff,beam_competitors_5km_health_diff,beam_competitors_5km_sentiment_diff,beam_competitors_10km_rank_by_score,beam_competitors_10km_rank_by_rating,beam_competitors_10km_rank_by_reviews,beam_competitors_10km_score_percentile,beam_competitors_1km_competitive_tier,beam_competitors_10km_rating_percentile,beam_competitors_10km_reviews_percentile,beam_competitors_10km_health_percentile,beam_competitors_10km_sentiment_percentile,beam_competitors_5km_competitive_tier,beam_competitors_10km_competitor_avg_score,beam_competitors_10km_competitor_avg_rating,beam_competitors_10km_competitor_avg_reviews,beam_competitors_10km_competitor_avg_health,beam_competitors_10km_competitive_tier,beam_competitors_10km_competitor_avg_sentiment,beam_competitors_10km_score_diff,beam_competitors_10km_rating_diff,beam_competitors_10km_reviews_diff,beam_competitors_10km_health_diff,beam_competitors_10km_sentiment_diff,beam_competitors_1km_total_in_radius,beam_competitors_5km_total_in_radius,beam_competitors_10km_total_in_radius,beam_competitors_1km_avg_distance_m,beam_competitors_1km_closest_competitor_m,beam_competitors_1km_market_type,beam_competitors_1km_review_share,beam_competitors_1km_density_per_sqkm,beam_competitors_1km_tier_below_40,beam_competitors_1km_tier_40_59,beam_competitors_1km_tier_60_79,beam_competitors_1km_tier_80_100,beam_competitors_5km_avg_distance_m,beam_competitors_5km_closest_competitor_m,beam_competitors_5km_market_type,beam_competitors_5km_review_share,beam_competitors_5km_density_per_sqkm,beam_competitors_5km_tier_below_40,beam_competitors_5km_tier_40_59,beam_competitors_5km_tier_60_79,beam_competitors_5km_tier_80_100,beam_competitors_10km_avg_distance_m,beam_competitors_10km_closest_competitor_m,beam_competitors_10km_market_type,beam_competitors_10km_review_share,beam_competitors_10km_density_per_sqkm,beam_competitors_10km_tier_below_40,beam_competitors_10km_tier_40_59,beam_competitors_10km_tier_60_79,beam_competitors_10km_tier_80_100,beam_competitors_city_competitor_avg_sentiment_30d,beam_competitors_city_competitor_avg_sentiment_90d,beam_competitors_city_sentiment_diff_30d,beam_competitors_city_sentiment_diff_90d,beam_competitors_city_competitor_count,beam_competitors_city_total_in_city,beam_competitors_city_rank_by_score,beam_competitors_city_rank_by_rating,beam_competitors_city_rank_by_reviews,beam_competitors_city_score_percentile,beam_competitors_city_rating_percentile,beam_competitors_city_reviews_percentile,beam_competitors_city_health_percentile,beam_competitors_city_sentiment_percentile,beam_competitors_city_competitor_avg_score,beam_competitors_city_competitor_avg_rating,beam_competitors_city_competitor_avg_reviews,beam_competitors_city_competitor_avg_health,beam_competitors_city_competitor_avg_sentiment,beam_competitors_city_score_diff,beam_competitors_city_rating_diff,beam_competitors_city_reviews_diff,beam_competitors_city_health_diff,beam_competitors_city_sentiment_diff,beam_competitors_city_market_type,beam_competitors_city_review_share,beam_competitors_city_density_per_sqkm,beam_competitors_city_tier_below_40,beam_competitors_city_tier_40_59,beam_competitors_city_tier_60_79,beam_competitors_city_tier_80_100,beam_competitors_city_competitive_strength,beam_competitors_city_underserved_score,beam_competitors_city_competition_intensity,beam_competitors_state_competitor_avg_sentiment_30d,beam_competitors_state_competitor_avg_sentiment_90d,beam_competitors_state_sentiment_diff_30d,beam_competitors_state_sentiment_diff_90d,beam_competitors_state_competitor_count,beam_competitors_state_total_in_state,beam_competitors_state_rank_by_score,beam_competitors_state_rank_by_rating,beam_competitors_state_rank_by_reviews,beam_competitors_state_score_percentile,beam_competitors_state_rating_percentile,beam_competitors_state_reviews_percentile,beam_competitors_state_health_percentile,beam_competitors_state_sentiment_percentile,beam_competitors_state_competitor_avg_score,beam_competitors_state_competitor_avg_rating,beam_competitors_state_competitor_avg_reviews,beam_competitors_state_competitor_avg_health,beam_competitors_state_competitor_avg_sentiment,beam_competitors_state_score_diff,beam_competitors_state_rating_diff,beam_competitors_state_reviews_diff,beam_competitors_state_health_diff,beam_competitors_state_sentiment_diff,beam_competitors_state_market_type,beam_competitors_state_review_share,beam_competitors_state_density_per_sqkm,beam_competitors_state_underserved_score,beam_competitors_state_competition_intensity,beam_competitors_state_competitive_strength,beam_competitors_country_competitor_avg_sentiment_30d,beam_competitors_country_competitor_avg_sentiment_90d,beam_competitors_country_sentiment_diff_30d,beam_competitors_country_sentiment_diff_90d,beam_competitors_country_competitor_count,beam_competitors_country_competitor_avg_score,beam_competitors_country_competitor_avg_rating,beam_competitors_country_competitor_avg_reviews,beam_competitors_country_competitor_avg_health,beam_competitors_country_competitor_avg_sentiment,beam_competitors_country_score_diff,beam_competitors_country_rating_diff,beam_competitors_country_reviews_diff,beam_competitors_country_sentiment_diff,beam_competitors_country_score_percentile,beam_competitors_country_rating_percentile,beam_competitors_country_reviews_percentile,beam_competitors_country_health_percentile,beam_competitors_country_sentiment_percentile,beam_competitors_country_rank_by_score,beam_competitors_country_competitive_strength,beam_competitors_country_health_diff,beam_competitors_country_rank_by_rating,beam_competitors_country_rank_by_reviews,beam_competitors_country_tier_40_59,beam_competitors_country_tier_60_79,beam_competitors_country_tier_80_100,beam_competitors_country_tier_below_40,beam_competitors_country_total_in_country,beam_competitors_city_siblings_competitor_count,beam_competitors_city_siblings_competitor_avg_score,beam_competitors_city_siblings_competitor_avg_rating,beam_competitors_city_siblings_competitor_avg_reviews,beam_competitors_city_siblings_competitor_avg_health,beam_competitors_city_siblings_competitor_avg_sentiment,beam_competitors_city_siblings_score_diff,beam_competitors_city_siblings_rating_diff,beam_competitors_city_siblings_reviews_diff,beam_competitors_city_siblings_sentiment_diff,beam_competitors_city_siblings_score_percentile,beam_competitors_city_siblings_rating_percentile,beam_competitors_city_siblings_reviews_percentile,beam_competitors_city_siblings_health_percentile,beam_competitors_city_siblings_sentiment_percentile,beam_competitors_city_siblings_rank_by_score,beam_competitors_city_siblings_competitor_avg_recommend_pct,beam_competitors_city_siblings_recommend_pct_diff,beam_competitors_city_siblings_recommend_pct_percentile,beam_competitors_city_siblings_total_siblings,beam_competitors_city_businesses_per_10k_pop,beam_competitors_city_population_per_business,beam_competitors_city_population_density,beam_competitors_city_reviews_per_capita,beam_competitors_city_reviews_per_10k_pop,beam_competitors_state_businesses_per_10k_pop,beam_competitors_state_population_per_business,beam_competitors_state_population_density,beam_competitors_state_reviews_per_capita,beam_competitors_state_reviews_per_10k_pop,beam_competitors_1km_hhi_contribution,beam_competitors_1km_hhi_minimum,beam_competitors_5km_hhi_contribution,beam_competitors_5km_hhi_minimum,beam_competitors_10km_hhi_contribution,beam_competitors_10km_hhi_minimum,beam_competitors_city_hhi_contribution,beam_competitors_city_hhi_minimum,beam_competitors_state_hhi_contribution,beam_competitors_state_hhi_minimum,beam_trends_score_30d_beam_score_overall,beam_trends_score_30d_rating,beam_trends_score_30d_review_count,beam_trends_score_30d_beam_rating_health,beam_trends_score_30d_beam_popularity_percentile,beam_trends_score_90d_beam_score_overall,beam_trends_score_90d_rating,beam_trends_score_90d_review_count,beam_trends_score_90d_beam_rating_health,beam_trends_score_90d_beam_popularity_percentile,beam_trends_competitive_1km_30d_strength_change,beam_trends_competitive_1km_30d_rank_change,beam_trends_competitive_1km_30d_percentile_change,beam_trends_competitive_1km_90d_strength_change,beam_trends_competitive_1km_90d_rank_change,beam_trends_competitive_1km_90d_percentile_change,beam_trends_competitive_5km_30d_strength_change,beam_trends_competitive_5km_30d_rank_change,beam_trends_competitive_5km_30d_percentile_change,beam_trends_competitive_5km_90d_strength_change,beam_trends_competitive_5km_90d_rank_change,beam_trends_competitive_5km_90d_percentile_change,beam_trends_competitive_10km_30d_strength_change,beam_trends_competitive_10km_30d_rank_change,beam_trends_competitive_10km_30d_percentile_change,beam_trends_competitive_10km_90d_strength_change,beam_trends_competitive_10km_90d_rank_change,beam_trends_competitive_10km_90d_percentile_change,beam_trends_competitive_city_30d_strength_change,beam_trends_competitive_city_30d_rank_change,beam_trends_competitive_city_30d_percentile_change,beam_trends_competitive_city_90d_strength_change,beam_trends_competitive_city_90d_rank_change,beam_trends_competitive_city_90d_percentile_change,beam_trends_competitive_state_30d_strength_change,beam_trends_competitive_state_30d_rank_change,beam_trends_competitive_state_30d_percentile_change,beam_trends_competitive_state_90d_strength_change,beam_trends_competitive_state_90d_rank_change,beam_trends_competitive_state_90d_percentile_change,beam_trends_sentiment_current_sentiment,beam_trends_sentiment_positive_ratio,beam_trends_sentiment_negative_ratio,beam_trends_sentiment_review_count,beam_trends_velocity_reviews_per_day,beam_trends_velocity_reviews_per_month,beam_trends_velocity_percentile_city,beam_trends_velocity_percentile_state,beam_trends_velocity_trend,beam_velocity_reviews_per_day,beam_velocity_reviews_per_week,beam_velocity_reviews_per_month,beam_velocity_reviews_last_30d,beam_velocity_reviews_last_90d,beam_velocity_reviews_last_365d,beam_velocity_percentile_1km,beam_velocity_percentile_5km,beam_velocity_percentile_10km,beam_velocity_percentile_city,beam_velocity_percentile_state,beam_velocity_rank_1km,beam_velocity_rank_5km,beam_velocity_rank_10km,beam_velocity_rank_city,beam_velocity_rank_state,beam_velocity_trend,beam_velocity_change_30d,beam_velocity_change_90d,beam_trends_sentiment_recommend_pct
A6GPVK2S,Hunt Brothers Pizza,Food and Drink,Restaurants,Pizza restaurant,Pizza restaurant,"1001 S Veterans St, Flandreau, SD 57028",1001 S Veterans St,Flandreau,South Dakota,,,57028,US,True,44.038441999999996,-96.607484,America/Chicago,(605) 53*-****,1,OPERATIONAL,TRUE,TRUE,,True,Flandreau,South Dakota,US,https,https://huntbrotherspizza.com,huntbrotherspizza.com,huntbrotherspizza.com,com,8666,2002-08-14,2026-08-14,"GoDaddy.com, LLC",,,0,0,0,Convenience store-based pizza chain doling out create-your-own pies along with wings.,TRUE,TRUE,5,0,"{""1"": 0, ""2"": 0, ""3"": 0, ""4"": 0, ""5"": 2}","Takeout, Dine-in",,"Breakfast, Lunch, Dinner, Solo dining","Wheelchair accessible entrance, Wheelchair accessible parking lot","Comfort food, Quick bite","Breakfast, Brunch, Lunch, Dinner, Counter service",,Casual,Tourists,,"Credit cards, Debit cards",Good for kids,TRUE,TRUE,purchase_dataset@,FALSE,TRUE,0,,,,,,,,,,,,,,,,,,,,,,,,,,,,,,,,,,,,,,,,,,,https://huntbrotherspizza.com/menu,,,2026-05-07T02:26:54.878778+00:00,0.0,,2.6,4418.21,1722.2,27.3684,0.3,0.0,0.0,50.0,,,,,,,,,,,,,,,,,,,,,,,,,,,,,,,,,,,,31.1,19.5,8,80,50.0,54.0,9,19,19,2065,5241,5241,738652,1459523,1459523,797392,9,,,,,,,,,,1774,,,,,,,,,,,,,,,,,,,,,,,,,,,,,,,,,,,,,,,,,,,,,,,,,,,,,,,,,,,,,,,,,,,,,,,,,,,,,,,,,,,,,,,,,,,,,,,,,,,,,,,,,,,,,,,,,,,,,,,,,,,,,,,,,,,,,,,,,,,,,,,,,,,,,,,,,,,,,,,,,,,,,,,,,,,,,,,,,,,,,,,,,,,,,,,,,,,,,,,,,,,,,,11,33.8,4.57,95,76.3,0.2468,-2.7,,-95,-0.2468,0.5,0.7,0.0,0.0,0.0,5,28.89,-28.89,0.0,11,,,,,,,,,,,,,,,,,,,,,5.9,,0,0.0,0.0,13.3,,0,0.0,19.5,,,,,,,,,,,,,,,,,,,,,,,,,,,,,,,,,,,,,,,,,,,,,,,,,,,,,,,,,,,
WVSC6HWW,Hunt Brothers Pizza,Food and Drink,Restaurants,Pizza restaurant,Pizza restaurant,"650 Main St, Big Stone City, SD 57216",650 Main St,Big Stone City,South Dakota,,,57216,US,True,45.2913268,-96.4651351,America/Chicago,(605) 54*-****,1,OPERATIONAL,TRUE,TRUE,,True,Big Stone City,South Dakota,US,https,https://huntbrotherspizza.com,huntbrotherspizza.com,huntbrotherspizza.com,com,8666,2002-08-14,2026-08-14,"GoDaddy.com, LLC",,,0,0,0,Convenience store-based pizza chain doling out create-your-own pies along with wings.,TRUE,TRUE,0,0,"{""1"": 0, ""2"": 0, ""3"": 0, ""4"": 0, ""5"": 0}","Takeout, Dine-in",,Breakfast,"Wheelchair accessible entrance, Wheelchair accessible parking lot, Wheelchair accessible restroom, Wheelchair accessible seating","Coffee, Comfort food, Quick bite","Breakfast, Brunch, Lunch, Dinner, Counter service, Seating",Restroom,Casual,,,"Credit cards, Debit cards","Good for kids, High chairs, Kids' menu",TRUE,TRUE,purchase_dataset@,FALSE,TRUE,0,,,,,,,,,,,,,,,,,,,,,,,,,,,,,,,,,,,,,,,,,,,https://huntbrotherspizza.com/menu,,,2026-05-07T01:20:22.840922+00:00,,,,,,,,0.0,0.0,50.0,,,,,,,,,,,,,,,,,,,,,,,,,,,,,,,,,,,,31.1,19.5,8,80,50.0,54.0,1,2,2,2208,5868,5868,782968,1604785,1604785,845591,1,,,,,,,,,,1774,,,,,,,,,,,,,,,,,,,,,,,,,,,,,,,,,,,,,,,,,,,,,,,,,,,,,,,,,,,,,,,,,,,,,,,,,,,,,,,,,,,,,,,,,,,,,,,,,,,,,,,,,,,,,,,,,,,,,,,,,,,,,,,,,,,,,,,,,,,,,,,,,,,,,,,,,,,,,,,,,,,,,,,,,,,,,,,,,,,,,,,,,,,,,,,,,,,,,,,,,,,,,,1,31.1,,0,50.0,0.0,0.0,,0,0.0,0.0,0.0,0.0,0.0,0.0,1,0.0,0.0,0.0,1,,,,,,,,,,,,,,,,,,,,,5.9,,0,0.0,0.0,13.3,,0,0.0,19.5,,,,,,,,,,,,,,,,,,,,,,,,,,,,,,,,,,,,,,,,,,,,,,,,,,,,,,,,,,,
KPRNZ6QC,Hunt Brothers Pizza,Food and Drink,Restaurants,Pizza restaurant,"Pizza restaurant, Pizza Takeout","800 Nesbitt Dr, Ipswich, SD 57451",800 Nesbitt Dr,Mina,South Dakota,,,57451,US,True,45.4368279,-98.7326817,America/Chicago,(605) 72*-****,1,OPERATIONAL,TRUE,TRUE,Mina,False,Mina,South Dakota,US,https,https://huntbrotherspizza.com,huntbrotherspizza.com,huntbrotherspizza.com,com,8666,2002-08-14,2026-08-14,"GoDaddy.com, LLC",,,0,0,0,Convenience store-based pizza chain doling out create-your-own pies along with wings.,TRUE,TRUE,5.0,1,"{""1"": 0, ""2"": 0, ""3"": 0, ""4"": 0, ""5"": 1}","Takeout, Dine-in",,Lunch,"Wheelchair accessible entrance, Wheelchair accessible parking lot","Coffee, Comfort food, Quick bite","Breakfast, Brunch, Lunch, Dinner, Counter service",Restroom,Casual,Tourists,,"Credit cards, Debit cards",Good for kids,TRUE,TRUE,purchase_dataset@,FALSE,TRUE,0,,,,,,,,,,,,,,,,,,,,,,,,,,,,,,,,,,,,,,,,,,,https://huntbrotherspizza.com/menu,,,2026-05-07T01:19:34.750857+00:00,0.0,,1.4,4530.69,1263.2,44.4444,0.84,100.0,10.0,100.0,,,,,,,,,,,,,,,,,,,,,,,,,,,,,,,,,,,,56.1,19.5,8,80,50.0,54.0,64762,14629,114981,1948,425,4888,710727,106963,1377319,767068,64762,,,,,,,,,,64,,,,,,,,,,,,,,,,,,,,,,,,,,,,,,,,,,,,,,,,,,,,,,,,,,,,,,,,,,,,,,,,,,,,,,,,,,,,,,,,,,,,,,,,,,,,,,,,,,,,,,,,,,,,,,,,,,,,,,,,,,,,,,,,,,,,,,,,,,,,,,,,,,,,,,,,,,,,,,,,,,,,,,,,,,,,,,,,,,,,,,,,,,,,,,,,,,,,,,,,,,,,,,,,,,,,,,,,,,,,,,,,,,,,,,,,,,,,,,,,,,,,,,2.4,0.0,0,0.0,0.0,38.3,0.0,1,50.0,19.5,,,,,,,,,,,,,,,,,,,,,,,,,,,,,,,,,,,,,,,,,,,,,,,,,,,,,,,,,,,
ZYK3MKJV,Hunt Brothers Pizza,Food and Drink,Restaurants,Pizza restaurant,"Pizza restaurant, Pizza Takeout","21399 US-385, Deadwood, SD 57732",21399 US-385,Deadwood,South Dakota,,,57732,US,False,44.2999949,-103.6791889,America/Denver,(605) 57*-****,0,OPERATIONAL,TRUE,FALSE,,False,Deadwood,South Dakota,US,https,https://huntbrotherspizza.com,huntbrotherspizza.com,huntbrotherspizza.com,com,8666,2002-08-14,2026-08-14,"GoDaddy.com, LLC",,,0,0,0,Convenience store-based pizza chain doling out create-your-own pies along with wings.,TRUE,FALSE,0,0,"{""1"": 0, ""2"": 0, ""3"": 0, ""4"": 0, ""5"": 0}",Outdoor seating,,,Wheelchair accessible entrance,,"Breakfast, Brunch, Lunch, Dinner, Counter service, Seating",,,,,,,FALSE,TRUE,purchase_dataset@,FALSE,TRUE,0,,,,,,,,,,,,,,,,,,,,,,,,,,,,,,,,,,,,,,,,,,,https://huntbrotherspizza.com/menu,,,2026-05-07T00:53:20.793097+00:00,0.0,,6.5,101435.99,20021.8,406.5934,0.05,0.0,0.0,50.0,,,,,,0.0,,0.0789,,,,,,,,,,,,,,,,,,,,,,,,,,,,29.1,19.5,8,60,50.0,54.0,79679,168340,168340,2227,5967,5967,789609,1626300,1626300,852800,79679,2,2,2,,,,37,39,39,1774,,,,,,,,0.021,0.1354,0.1313,-0.1354,-0.1313,0.0,0.0,0.0,0.0,0.0,,,,,,38,1,,2,2,2,0.0,0.0,0.0,0.0,0.0,66.4,4.96,23,100.0,1.0,-37.3,,-23,-50.0,-1.0,,,,,,,,,,,,,,,,,,,37,39,39,0.0526,Emerging,0.0,0.0,0.0526,0.0789,,63.8,4.14,362,78.0,Emerging,0.5145,-34.7,,-362,-28.0,-0.5145,2,,39,226,226,concentrated,0.0,0.32,0.0,0.0,100.0,0.0,,,,,,,,,,9374,8548,competitive,0.0,0.12,7.9,15.8,68.4,7.9,0.0698,0.0876,-0.0698,-0.0876,36,37,36,37,37,0.0278,0.0,0.0,0.0556,0.0556,64.3,4.04,326,75.1,0.4869,-35.2,,-326,-25.1,-0.4869,competitive,0.0,2.82,5.6,19.4,69.4,5.6,0.0111,0.05,200.24,0.3781,0.6063,-0.3781,-0.6063,160,161,160,161,161,0.0063,0.0,0.0,0.0,0.0063,77.9,4.47,874,87.2,0.7142,-48.8,,-874,-37.2,-0.7142,competitive,0.0,0.0008,0.98,1.6,0.0025,0.064,0.2835,-0.064,-0.2835,853667,58.5,3.82,406,76.2,0.4631,-29.4,,-406,-0.4631,0.1001,0.9127,0.0,0.0481,0.0391,758821,0.3138,-26.2,1,779132,25.5,57.6,2.1,14.7,853668,,,,,,,,,,,,,,,,,,,,,311.42,32,91,10.1436,101435.99,2.05,4869,4,0.1796,1795.89,0.0,5000.0,,,0.0,256.41,0.0,270.27,0.0,62.11,5.6,,0,0.0,0.0,11.8,,0,0.0,19.5,-0.01,-740790,-0.008,0.0,2,0.0,0.0,0,0.0,0.0,0,0.0,-0.09,-696131,-0.02,0.02,37,0.053,-0.49,-4318,-0.341,0.01,36,0.028,-0.32,-1866,-0.111,0.0,160,0.006,,,,,,,,,,,,,,,,,,,,,,,,,,,,,
RYEX2ZTG,Dock Side,Food and Drink,Restaurants,American restaurant,American restaurant,"28229 Spring Creek Pl, Pierre, SD 57501",28229 Spring Creek Pl,Pierre,South Dakota,,,57501,US,True,44.546322599999996,-100.4897876,America/Chicago,(605) 22*-****,2,OPERATIONAL,TRUE,TRUE,,True,Pierre,South Dakota,US,,,,,,,,,,,,0,0,0,,TRUE,FALSE,5.0,13,"{""1"": 0, ""2"": 0, ""3"": 0, ""4"": 0, ""5"": 19}","Outdoor seating, Takeout, Dine-in","Fast service, Sports","Dinner, Solo dining","Wheelchair accessible entrance, Wheelchair accessible parking lot, Wheelchair accessible restroom, Wheelchair accessible seating","Alcohol, Comfort food","Dinner, Seating","Bar onsite, Restroom, Wi-Fi",Casual,"Family-friendly, LGBTQ+ friendly, Tourists, Transgender safespace",Accepts reservations,"Credit cards, Debit cards","Good for kids, Has changing table(s), High chairs, Kids' menu",FALSE,FALSE,purchase_dataset@,FALSE,TRUE,0,,,,,,,,,,,,,,,,,,,,,,,,,,,,,,,,,,,,,,,,,,,,,,2026-05-07T00:12:37.621323+00:00,0.0,0.0,3.1,8815.56,1682.8,98.3213,0.53,100.0,38.2,100.0,1.0,,1.0,1.0,1.0,,,,100.0,100.0,,,,100.0,0.0,0.0,100.0,0.0,0.0,100.0,0.0,0.0,stable,stable,,0.0,0.0,0.0,0,1,13,13,-84.6,-69.2,-100.0,63.2,9.5,8,30,100.0,54.0,35,2,96,1706,111,4023,639780,24871,1181014,689083,35,,,,,,,,,,11,,,,,,,,,,,,,,,,,,,,,,,,,,,,,,,,,,,,,,,,,,,,,,,,,,,,,,,,,,,,,,,,,,,,,,,,,,,,,,,,,,,,,,,,,,,,,,,,,,,,,,,,,,,,,,,,,,,,,,,,,,,,,,,,,,,,,,,,,,,,,,,,,,,,,,,,,,,,,,,,,,,,,,,,,,,,,,,,,,,,,,,,,,,,,,,,,,,,,,,,,,,,,,32,57.8,4.13,275,75.0,0.4289,5.4,0.87,-262,0.5711,0.5484,0.8387,0.1935,0.9355,1.0,15,57.04,42.96,1.0,32,,,,,,,,,,,,,,,,,,,,,4.0,0.0,0,0.0,0.0,9.1,0.0,0,0.0,-9.4,,,,,,,,,,,,,,,,,,,,,,,,,,,,,,,1.0,,,13,0.0,0.0,0.0,0.0,decelerating,0.00,0.00,0.00,0,1,13,,,,0.000,0.000,,,,2,55,decelerating,,,100.0
